[
  {
    "key": "message.announcement.publish.confirm.title",
    "zh-CN": "确认发布",
    "en-US": "Confirm publication",
    "source": "import",
    "refType": "action"
  },
  {
    "key": "message.announcement.publish.confirm.content",
    "zh-CN": "发布后该公告将对读者可见，确定发布吗？",
    "en-US": "Publishing will make this announcement visible to readers. Publish it?",
    "source": "import",
    "refType": "action"
  },
  {
    "key": "message.announcement.archive.confirm.title",
    "zh-CN": "确认撤回",
    "en-US": "Confirm withdrawal",
    "source": "import",
    "refType": "action"
  },
  {
    "key": "message.announcement.archive.confirm.content",
    "zh-CN": "撤回后该公告将不再对读者展示，可稍后重新发布。确定撤回吗？",
    "en-US": "Withdrawing will hide this announcement from readers. You can publish it again later. Withdraw it?",
    "source": "import",
    "refType": "action"
  },
  {
    "key": "message.announcement.republish.confirm.title",
    "zh-CN": "建立修订草稿",
    "en-US": "Create revision draft",
    "source": "import",
    "refType": "action"
  },
  {
    "key": "message.announcement.republish.confirm.content",
    "zh-CN": "将基于历史版本建立可编辑草稿，保存不会直接发布。确定建立吗？",
    "en-US": "Create an editable draft from the historical version? Saving does not publish it.",
    "source": "import",
    "refType": "action"
  },
  {
    "key": "announcement.error.operation_required",
    "zh-CN": "请刷新后重试，操作标识缺失。",
    "en-US": "Refresh and retry: the operation identity is missing.",
    "source": "import",
    "refType": "message"
  },
  {
    "key": "announcement.error.protected_input",
    "zh-CN": "包含不可直接修改的公告字段，请刷新后重试。",
    "en-US": "Protected announcement fields cannot be changed directly.",
    "source": "import",
    "refType": "message"
  },
  {
    "key": "announcement.error.publication_unavailable",
    "zh-CN": "公告发布尚未启用：需要先完成受众授权与可靠分发接入。",
    "en-US": "Announcement publication is not enabled until audience authorization and reliable delivery are installed.",
    "source": "import",
    "refType": "message"
  },
  {
    "key": "announcement.error.not_found",
    "zh-CN": "公告不存在或无权访问。",
    "en-US": "The announcement does not exist or is not accessible.",
    "source": "import",
    "refType": "message"
  },
  {
    "key": "announcement.error.not_editable",
    "zh-CN": "当前状态不能执行此操作，请刷新查看最新状态。",
    "en-US": "This action is unavailable in the current state. Refresh to see the latest state.",
    "source": "import",
    "refType": "message"
  },
  {
    "key": "announcement.error.history_protected",
    "zh-CN": "此公告已有历史版本，不能删除。",
    "en-US": "This announcement has historical versions and cannot be deleted.",
    "source": "import",
    "refType": "message"
  },
  {
    "key": "announcement.error.invalid_input",
    "zh-CN": "公告输入不符合要求。",
    "en-US": "The announcement input is invalid.",
    "source": "import",
    "refType": "message"
  },
  {
    "key": "announcement.error.title_length",
    "zh-CN": "公告标题最多256个字符。",
    "en-US": "The announcement title must not exceed 256 characters.",
    "source": "import",
    "refType": "message"
  },
  {
    "key": "announcement.error.command_required",
    "zh-CN": "请通过公告受控操作完成修改。",
    "en-US": "Use an authorized announcement command to make changes.",
    "source": "import",
    "refType": "message"
  },
  {
    "key": "announcement.error.attachment_unavailable",
    "zh-CN": "附件不可用，请确认已上传完成且属于当前租户。",
    "en-US": "The attachment is unavailable. Check that its upload is finalized in this tenant.",
    "source": "import",
    "refType": "message"
  },
  {
    "key": "announcement.error.exemption_required",
    "zh-CN": "免审发布需要选择免审模式并填写免审原因。",
    "en-US": "Choose exemption mode and provide an exemption reason.",
    "source": "import",
    "refType": "message"
  },
  {
    "key": "announcement.error.content_required",
    "zh-CN": "发布前请补全公告标题和正文。",
    "en-US": "Complete the announcement title and content before publication.",
    "source": "import",
    "refType": "message"
  },
  {
    "key": "announcement.error.schedule_invalid",
    "zh-CN": "预约时间必须晚于当前时间，请重新选择。",
    "en-US": "Choose a scheduled time in the future.",
    "source": "import",
    "refType": "message"
  },
  {
    "key": "announcement.error.expiry_invalid",
    "zh-CN": "有效期不能早于发布时间或知悉截止时间，请调整。",
    "en-US": "The expiry must cover publication and the acknowledgement deadline.",
    "source": "import",
    "refType": "message"
  },
  {
    "key": "announcement.error.audience_empty",
    "zh-CN": "没有符合授权规则的接收人，请调整通知对象。",
    "en-US": "No authorized recipients matched. Update the audience.",
    "source": "import",
    "refType": "message"
  },
  {
    "key": "announcement.error.approval_not_ready",
    "zh-CN": "审批依据尚未就绪，请核对审批进展。",
    "en-US": "Approval authority is not ready. Check approval progress.",
    "source": "import",
    "refType": "message"
  },
  {
    "key": "announcement.error.authorization_changed",
    "zh-CN": "发布授权已变化，请重新核对范围并提交。",
    "en-US": "Publication authorization changed. Review the audience and submit again.",
    "source": "import",
    "refType": "message"
  },
  {
    "key": "announcement.error.delivery_disabled",
    "zh-CN": "通知桥接尚未启用，请联系租户管理员完成配置后再发布。",
    "en-US": "The notification bridge is disabled. Ask the tenant administrator to enable it before publication.",
    "source": "import",
    "refType": "message"
  },
  {
    "key": "message.announcement.cancel_schedule.confirm.title",
    "zh-CN": "取消发布安排",
    "en-US": "Cancel release",
    "source": "import",
    "refType": "action"
  },
  {
    "key": "message.announcement.cancel_schedule.confirm.content",
    "zh-CN": "取消后不会发布，冻结版本和历史记录仍会保留。确定取消吗？",
    "en-US": "The release will stop. Its frozen version and history will remain. Cancel it?",
    "source": "import",
    "refType": "action"
  }
]
